platform,title,company,company_key,location,link,description,description_en,job_tonality_score,job_sentiment
Work.ua,Data analyst,CreditKasa,creditkasa,Дистанційна робота,https://www.work.ua/jobs/5581182/,"Ласкаво просимо в Creditkasa. Це компанія, що пишається своєю позицією як лідера у секторі кредитування, забезпечуючи передові фінансові рішення вже більше 8ми років. Ми є втіленням інновацій у FinTech-просторі, невпинно працюємо над тим, щоб вибудовувати міцні та надійні відносини з клієнтами та співробітниками. Запрошуємо Data Analyst стати частиною нашої зіркової команди Наші очікування від тебе: SQL (діалект: PostgreSQL, DML, DDL, ETL/ELT). Python (бібліотеки статистичного аналізу та data science). Здатність знаходити й презентувати причинно-наслідкові зв’язки. Досвід роботи 3+ роки. Хороший академічний бекграунд (статистика, оптимізаційні задачі). Гнучкі вимоги: AWS (particularly Redshift, S3)/ Frameworks django/flask/fast api, html/ccs, js/php. Frameworks візуалізації (PowerBI, Dash etc), Linux/CLI. Знання продуктів кредитування, знання принципів роботи колл-центрів Обов’язки: Дослідження показників операційних процесів з метою виявлення причин і прогнозування динаміки. Предиктивне моделювання. Дослідження з сегментації клієнтів. Операційні дослідження з оптимізації процесів. Участь у безпосередньому створенні нових і зміні існуючих каналів взаємодії з клієнтами. Ми пропонуємо: Офіційне працевлаштування — жодних конвертів, 100% біла зарплата, наша компанія є лідером зі сплати податків у своїй сфері. Медичне страхування. Яскраве корпоративне життя, з яким ти можеш ознайомитися в нашому Instagram-акаунті: https://instagram.com/team_creditkasa Ми активно займаємося волонтерською діяльністю : Відвідуємо притулки для тварин. Здаємо кров. Робимо донати та запускаємо власні збори для наближення перемоги :) Надсилай своє резюме прямо зараз або пиши в телеграм @hrcreditkasa! Чекаємо в нашій команді СreditKasa.","Welcome to Creditkasa. It is a company proud of its position as a leader in the lending sector, providing advanced financial solutions for more than 8 years. We are the epitome of innovation in the FinTech space, working tirelessly to build strong and reliable relationships with clients and employees. We invite Data Analyst to be part of our stellar team What we expect from you: SQL (dialect: PostgreSQL, DML, DDL, ETL/ELT). Python (libraries for statistical analysis and data science). Ability to find and present causal relationships. Work experience of 3+ years. Good academic background (statistics, optimization problems). Flexible requirements: AWS (particularly Redshift, S3)/ Frameworks django/flask/fast api, html/ccs, js/php. Visualization frameworks (PowerBI, Dash etc), Linux/CLI. Knowledge of lending products, knowledge of the principles of call centers Duties: Study of the indicators of operational processes in order to identify the causes and forecast the dynamics. Predictive modeling. Research on customer segmentation. Operational research on process optimization. Participation in the direct creation of new and change of existing channels of interaction with customers. We offer: Official employment - no envelopes, 100% white salary, our company is the leader in paying taxes in its field. Medical insurance. Bright corporate life, which you can familiarize yourself with on our Instagram account: https://instagram.com/team_creditkasa We are actively involved in volunteer activities: We visit animal shelters. We donate blood. We make donations and launch our own meetings to bring victory closer :) Send your resume right now or write to @hrcreditkasa in Telegram! We are waiting for you in our СreditKasa team.",0.6226,neutral
Work.ua,Middle Data Analyst,"БусСистем, ТзОВ",буссистем-тзов,Дистанційна робота,https://www.work.ua/jobs/7845552/,"INFOBUS Holding is an international IT company founded in 2002. We develop technologies that automate the passenger transportation market and simplify travel for millions of people worldwide. Our Products: 🔹 Bussystem.eu — a universal SaaS system for ticket booking and passenger transportation management 🔹 INFOBUS.eu — a marketplace for selling bus, train, and flight tickets We are currently looking for a Data Analyst to join our team and help us make data-driven decisions that move our products forward. What You’ll Be Doing: Develop and optimize SQL queries in BigQuery with a focus on performance and cost efficiency. Maintain and improve existing SQL solutions. Participate in the development and enhancement of data models, contributing to model expansion and improvements. Implement and perform ad-hoc tasks to help requestors make better decisions. Work with other parties of the company to understand and translate their needs into data-driven solutions (reports, dashboards, etc.). Develop and maintain dashboards in Looker Studio. Maintain documentation for data sources, dashboard logic, etc. What’s Important: 2+ years of experience in data analytics Advanced skills in SQL (BigQuery), Looker Studio (Tableau, Power BI) Experience with Google Analytics Strong problem-solving and analytical thinking skills Ability to identify key business needs and think critically Attention to detail, maintaining clean, consistent, and accurate data Ability to work independently, take ownership of projects, and deliver effectively What We Offer: Work in an international product company with ambitious tasks Remote format + flexible schedule A team that values quality, initiative, and transparency A product that makes a real impact on millions of users Interested in this opportunity? Send us your CV! 🚀","INFOBUS Holding is an international IT company founded in 2002. We develop technologies that automate the passenger transportation market and simplify travel for millions of people worldwide. Our Products: 🔹 Bussystem.eu — a universal SaaS system for ticket booking and passenger transportation management 🔹 INFOBUS.eu — a marketplace for selling bus, train, and flight tickets We are currently looking for a Data Analyst to join our team and help us make data-driven decisions that move our products forward. What You’ll Be Doing: Develop and optimize SQL queries in BigQuery with a focus on performance and cost efficiency. Maintain and improve existing SQL solutions. Participate in the development and enhancement of data models, contributing to model expansion and improvements. Implement and perform ad-hoc tasks to help requestors make better decisions. Work with other parties of the company to understand and translate their needs into data-driven solutions (reports, dashboards, etc.). Develop and maintain dashboards in Looker Studio. Maintain documentation for data sources, dashboard logic, etc. What’s Important: 2+ years of experience in data analytics Advanced skills in SQL (BigQuery), Looker Studio (Tableau, Power BI) Experience with Google Analytics Strong problem-solving and analytical thinking skills Ability to identify key business needs and think critically Attention to detail, maintaining clean, consistent, and accurate data Ability to work independently, take ownership of projects, and deliver effectively What We Offer: Work in an international product company with ambitious tasks Remote format + flexible schedule A team that values quality, initiative, and transparency A product that makes a real impact on millions of users Interested in this opportunity? Send us your CV! 🚀",0.0642,negative
Work.ua,Data analyst,Aventus Group,aventus,Дистанційна робота,https://www.work.ua/jobs/7791834/,"Чи готові ви зануритися в динамічний світ Fintech і залишити свій слід у світовому масштабі? Aventus Group — міжнародна фінтех-група, що охоплює три континенти протягом 15 років, запрошує вас приєднатися до нашої енергійної команди в якості Аналітика даних. Як аналітик даних у Aventus Group ви відіграватимете ключову роль у прийнятті обґрунтованих рішень за допомогою комплексного аналізу показників ефективності в компаніях нашої групи та окремих відділах. Чого ми очікуємо від вас: 1+ рік комерційного досвіду роботи аналітиком даних є обов’язковим; MS Excel на рівні просунутого користувача; Тверде знання SQL (написання запитів); Вміння працювати з великими обсягами інформації; Відмінні комунікативні навички; Логічне системне мислення; Здатність швидко адаптуватися до нових умов; Уважність до деталей; Середній або вищий рівень англійської є перевагою; Досвід роботи в банку та/або мікрокредитній компанії (МФО) на посаді аналітика — плюс; Досвід роботи з BI інструментами. Ми пропонуємо: Графік роботи: 5/2 (сб, нд — вихідні), офіційне працевлаштування, соцпакет; Медичне страхування; Досвід в міжнародної команді; Додаткові бонуси та мотивації; Всі необхідні інструменти для ефективної роботи, навчання та професійного зростання. Якщо ви захоплюєтеся аналізом даних і готові вплинути на світ фінтеху, ми хочемо почути вашу думку! Приєднуйтесь до нас у Aventus Group і станьте частиною нашої місії з просування інновацій і розширення можливостей окремих осіб і компаній у всьому світі.","Are you ready to dive into the dynamic world of Fintech and make your mark on a global scale? Aventus Group, an international fintech group spanning three continents for 15 years, invites you to join our energetic team as a Data Analyst. As a data analyst at Aventus Group, you will play a key role in making informed decisions through comprehensive analysis of performance indicators across our group companies and individual departments. What we expect from you: 1+ years of commercial data analyst experience is a must; MS Excel at the advanced user level; Solid knowledge of SQL (writing queries); Ability to work with large amounts of information; Excellent communication skills; Logical system thinking; Ability to quickly adapt to new conditions; Attention to detail; Intermediate or higher level of English is an advantage; Experience working in a bank and/or to a microcredit company (MFI) as an analyst — a plus; Experience with BI tools. We offer: Work schedule: 5/2 (Sat, Sun — weekend), official employment, social package; Medical insurance; Experience in an international team; Additional bonuses and motivations; All necessary tools for effective work, training and professional growth. If you're passionate about data analytics and ready to make an impact in the fintech world, we want to hear from you! Join us at Aventus Group and be part of our mission to advance innovation and empower individuals and businesses around the world.",0.522,neutral
Work.ua,Data analyst,Ajax Systems,ajax-systems,Київ,https://www.work.ua/jobs/7960395/,"Ajax Systems — міжнародна технологічна компанія і найбільший у Європі виробник охоронних систем. Продуктам Ajax довіряють уже понад 4,5 мільйони кінцевих користувачів і 330 тисяч PRO-користувачів у більш ніж 180 країнах. Компанія пропонує комплексні рішення для захисту житлових і комерційних об'єктів різного масштабу. Нині портфоліо Ajax налічує 280 пристроїв для захисту від вторгнення, відеоспостереження, пожежної безпеки та комфорту й автоматизації. Кожного року ми демонструємо кратне зростання як у чисельності команди, так і в кількості користувачів у всьому світі. За розробку пристроїв у Ajax відповідає R&D, який складається з чотирьох департаментів: System, Device, Automation та QA. Ми шукаємо не просто аналітика. Ми шукаємо людину, яка хоче розуміти, а не просто рахувати. Якщо ти любиш ставити питання, перевіряти припущення і шукати бізнес-сенс у числах — пиши, тобі точно до нас. Необхідні знання та навички: Ти відчуваєш драйв, коли копаєшся в причинно-наслідкових зв’язках . Вмієш слухати потреби користувачів , навіть якщо вони їх ще не до кінця сформулювали. Добре розбираєшся в Power BI, DAX, SQL , маєш досвід роботи з Jira або подібними системами . Розумієш, що аналітика — це сервіс , а не просто набір цифр. Завдання: Занурюватись у дані : з баз, Jira, Excel, API — і виводити з цього історію. Створювати живі та корисні Power BI дашборди , які хочеться відкривати. Працювати з SQL, DAX так, щоб навіть складні метрики ставали очевидними. Розбиратися, що насправді потрібно бізнесу — і втілювати це у зручну аналітику. Задавати питання. Швидко перевіряти гіпотези, не прив’язуючись до єдиного рішення — гнучкість > перфекціонізм. Покращувати, пришвидшувати, створювати. Пропонуємо: Можливість пропонувати та реалізовувати власні ідеї, які мають вплив на продукт і виробництво. Роботу у вмотивованій команді та zero bullshit culture. Конкурентну заробітну плату. Медичне страхування. Корпоративну англійську мову. Компенсацію профільного навчання. Можливість взяти участь у проєкті бета-тесту систем безпеки Ajax — отримання та тестування нових гаджетів до їх релізу. Ajax Systems — це українська історія успіху, місце неймовірної сили та енергії. Долучайтеся, щоб зробити Made in Ukraine 🇺🇦 синонімом надійності.","Ajax Systems is an international technology company and the largest manufacturer of security systems in Europe. Ajax products are already trusted by more than 4.5 million end users and 330 thousand PRO users in more than 180 countries. The company offers comprehensive solutions for the protection of residential and commercial facilities of various sizes. Currently, the Ajax portfolio includes 280 devices for intrusion protection, video surveillance, fire safety, and comfort and automation. Every year, we demonstrate multiple growth both in the size of the team and in the number of users worldwide. R&D is responsible for the development of devices at Ajax, which consists of four departments: System, Device, Automation and QA. We are not just looking for an analyst. We are looking for a person who wants to understand, not just count. If you like to ask questions, check assumptions and look for business sense in numbers, write to us. Necessary knowledge and skills: You feel driven when you dig into cause-and-effect relationships. You know how to listen to the needs of users, even if they have not yet fully formulated them. You are well versed in Power BI, DAX, SQL, have experience working with Jira or similar systems. You understand that analytics is a service, not just a set of numbers. Task: Immerse yourself in data: from databases, Jira, Excel, API — and derive a story from it. Create lively and useful Power BI dashboards that you want to open. Work with SQL, DAX so that even complex metrics become obvious. Understand what the business really needs — and turn it into convenient analytics. Ask questions. Quickly test hypotheses without committing to a single solution — flexibility > perfectionism. Improve, speed up, create. We offer: The opportunity to propose and implement your own ideas that have an impact on the product and production. Work in a motivated team and zero bullshit culture. Competitive salary. Medical insurance. Corporate English. Compensation for specialized training. The opportunity to participate in the beta test project of Ajax security systems — receiving and testing new gadgets before their release. Ajax Systems is a Ukrainian success story, a place of incredible strength and energy. Join us to make Made in Ukraine 🇺🇦 synonymous with reliability.",0.5372,neutral
Work.ua,"Middle Product, Data Analyst",Work.ua,work-ua,Львів,https://www.work.ua/jobs/6785923/,"Привіт! Ми — продуктова українська компанія Work.ua. Щомісяця 4 мільйони українців вибирають наш сервіс, щоб знаходити роботу або співробітників. Сотні тисяч користувачів відвідують Work.ua за допомогою мобільного застосунку. Ми прагнемо покращувати бізнес-результати та досвід користувача. Для цього нам важливо приймати оптимальні рішення у розробці продукту, маркетинговій та бізнес-стратегіях. Секрет таких рішень — в аналітиці. Що ти будеш робити: Робити продуктові дослідження на основі поведінки користувачів Підбивати підсумки продуктових ініціатив і формувати аналітичні звіти Розраховувати A/B тести, оцінювати їх вплив Аналізувати ринок праці та готувати зовнішню аналітику Налаштовувати та удосконалювати систему візуалізації даних Чого ми чекаємо від тебе: Ми шукаємо лише досвідчених аналітиків — від 2 років комерційного досвіду обов’язково Впевнене володіння SQL Знання Python (pandas, numpy) Розуміння статистики: A/B тести, статистичні гіпотези, аналіз результатів Знання інструментів візуалізації даних Що ми використовуємо: Python DB: MySQL Big Data: Apache Kafka, Apache Hadoop, Apache Spark ETL/ELT: Apache Airflow Visualization: Metabase Ми пропонуємо: Роботу, яка має сенс. Ти допомагаєш великим компаніям ефективніше наймати людей і розвиватися, а країні — зростати. Стабільність. Офіційне оформлення, оплачувані відпустка та лікарняні без довідок, виплата зарплати 2 рази на місяць без затримок, компенсація відряджень. Зростання доходу. Ми переглядаємо рівень зарплати двічі на рік. ЗСЖ. Ми любимо спорт, особливо біг — у нас навіть є біговий клуб. Сильну команду. Поруч — люди, на яких можна покластися. Розвиток. 50% компенсації навчання та часткова компенсація хобі — що ближче саме тобі. Відповідальність. Щомісяця передаємо для ЗСУ техніку, автівки, РЕБи — понад 4 млн грн. Як проходить відбір: Ми хочемо краще пізнати тебе, а ще дати можливість і тобі краще пізнати нас. Тому процес складається з кількох кроків: Знайомство з рекрутером — розмова, де розповімо більше про команду й дізнаємось про тебе. Технічна співбесіда — поговоримо про досвід, інструменти, кейси. Фінальна співбесіда — поговоримо про цінності, команду та майбутнє разом. Більше про нас читай на https://www.work.ua/careers/","Greetings! We are the Ukrainian food company Work.ua. Every month, 4 million Ukrainians choose our service to find work or employees. Hundreds of thousands of users visit Work.ua using the mobile application. We are committed to improving business results and user experience. For this, it is important for us to make optimal decisions in product development, marketing and business strategies. The secret of such decisions lies in analytics. What you will do: Conduct product research based on user behavior Summarize product initiatives and generate analytical reports Calculate A/B tests, evaluate their impact Analyze the labor market and prepare external analytics Set up and improve the data visualization system What we expect from you: We are only looking for experienced analysts - 2 years or more commercial experience is a must Solid command of SQL Knowledge of Python (pandas, numpy) Understanding of statistics: A/B tests, statistical hypotheses, analysis of results Knowledge of data visualization tools What we use: Python DB: MySQL Big Data: Apache Kafka, Apache Hadoop, Apache Spark ETL/ELT: Apache Airflow Visualization: Metabase We offer: Work that makes sense. You help large companies hire people more efficiently and develop, and the country to grow. Stability. Official registration, paid vacation and sick leave without certificates, salary payment twice a month without delays, compensation for business trips. Income growth. We review the salary level twice a year. ZSZH We love sports, especially running - we even have a running club. A strong team. Nearby are people you can rely on. Development. 50% compensation for education and partial compensation for hobbies - whichever is closer to you. Responsibility. Every month, we transfer equipment, cars, electronic equipment for the Armed Forces — more than UAH 4 million How is the selection process: We want to get to know you better, and also give you the opportunity to get to know us better. Therefore, the process consists of several steps: Getting to know the recruiter is a conversation where we will tell more about the team and learn about you. Technical interview - let's talk about experience, tools, cases. Final interview - let's talk about values, team and future together. Read more about us at https://www.work.ua/careers/",0.2162,negative
